{
  "schemaVersion": "1.0.0",
  "runnerId": "example-mobile-app-runner",
  "kind": "primary",
  "platforms": ["ios", "android"],
  "capabilities": ["launch", "sessionControl", "command", "logCapture", "artifactWrite"],
  "driverActions": ["tap", "scroll", "assertVisible", "inspectTree", "screenshot", "record", "readLogs"],
  "artifactOutputs": ["logs", "signals", "screenshot", "video", "uiTree"],
  "uiContexts": ["app"],
  "lifecycle": [
    "prepare",
    "launch",
    "startSession",
    "executeStep",
    "waitForTruthEvent",
    "captureEvidence",
    "stopSession",
    "finalize"
  ]
}
